"DESCRIPTION","DURATION IN MS","NAME","PARENT SUITE","START TIME","STATUS","STOP TIME","SUB SUITE","SUITE","TEST CLASS","TEST METHOD"
"","240","should respond to user input quickly","chromium","2025-12-22","passed","2025-12-22","Performance Tests","performance.spec.ts","",""
"","185","should have focus visible styles","chromium","2025-12-22","passed","2025-12-22","Accessibility Tests","accessibility.spec.ts","",""
"","10284","should clear form after successful submission","chromium","2025-12-22","failed","2025-12-22","Form Validation Tests","form-validation.spec.ts","",""
"","10300","should create a new user","chromium","2025-12-22","failed","2025-12-22","User Management","user-management.spec.ts","",""
"","285","should have accessible form validation messages","chromium","2025-12-22","passed","2025-12-22","Accessibility Tests","accessibility.spec.ts","",""
"","143","should have proper alt text or aria labels for images","chromium","2025-12-22","passed","2025-12-22","Accessibility Tests","accessibility.spec.ts","",""
"","230","should have labels associated with form inputs","chromium","2025-12-22","passed","2025-12-22","Accessibility Tests","accessibility.spec.ts","",""
"","303","should accept valid email formats","chromium","2025-12-22","passed","2025-12-22","Form Validation Tests","form-validation.spec.ts","",""
"","247","should display the application title","chromium","2025-12-22","passed","2025-12-22","User Management","user-management.spec.ts","",""
"","3180","should handle network timeout","chromium","2025-12-22","passed","2025-12-22","API Integration Tests","api-integration.spec.ts","",""
"","1202","should announce dynamic content changes","chromium","2025-12-22","passed","2025-12-22","Accessibility Tests","accessibility.spec.ts","",""
"","10264","should handle duplicate email error","chromium","2025-12-22","failed","2025-12-22","API Integration Tests","api-integration.spec.ts","",""
"","10281","should display success messages with proper styling","chromium","2025-12-22","failed","2025-12-22","UI/UX Tests","ui-ux.spec.ts","",""
"","10094","should display Swagger UI authentication section","chromium","2025-12-22","failed","2025-12-22","Authentication Tests","authentication.spec.ts","",""
"","5190","should display user list","chromium","2025-12-22","failed","2025-12-22","User Management","user-management.spec.ts","",""
"","30019","should refresh user list after successful creation","chromium","2025-12-22","broken","2025-12-22","API Integration Tests","api-integration.spec.ts","",""
"","10087","should open authentication modal when clicking authorize button","chromium","2025-12-22","failed","2025-12-22","Authentication Tests","authentication.spec.ts","",""
"","5173","should handle delete operations efficiently","chromium","2025-12-22","failed","2025-12-22","Performance Tests","performance.spec.ts","",""
"","10088","should allow logout and clear authentication state","chromium","2025-12-22","failed","2025-12-22","Authentication Tests","authentication.spec.ts","",""
"","170","should require email field","chromium","2025-12-22","passed","2025-12-22","Form Validation Tests","form-validation.spec.ts","",""
"","773","should load page within acceptable time","chromium","2025-12-22","passed","2025-12-22","Performance Tests","performance.spec.ts","",""
"","2271","should measure API response times","chromium","2025-12-22","passed","2025-12-22","Performance Tests","performance.spec.ts","",""
"","233","should validate email format","chromium","2025-12-22","passed","2025-12-22","Form Validation Tests","form-validation.spec.ts","",""
"","155","should have keyboard-accessible navigation","chromium","2025-12-22","passed","2025-12-22","Accessibility Tests","accessibility.spec.ts","",""
"","5245","should handle large dataset efficiently","chromium","2025-12-22","failed","2025-12-22","Performance Tests","performance.spec.ts","",""
"","230","should enforce maximum length for name","chromium","2025-12-22","passed","2025-12-22","Form Validation Tests","form-validation.spec.ts","",""
"","30020","should create 10 users automatically","chromium","2025-12-22","broken","2025-12-22","User Management","user-management.spec.ts","",""
"","30023","should have proper table structure with headers","chromium","2025-12-22","broken","2025-12-22","Accessibility Tests","accessibility.spec.ts","",""
"","10084","should accept username and password in authentication form","chromium","2025-12-22","failed","2025-12-22","Authentication Tests","authentication.spec.ts","",""
"","200","should support screen reader navigation","chromium","2025-12-22","passed","2025-12-22","Accessibility Tests","accessibility.spec.ts","",""
"","10084","should display locked/unlocked icons for protected endpoints","chromium","2025-12-22","failed","2025-12-22","Authentication Tests","authentication.spec.ts","",""
"","30020","should edit an existing user","chromium","2025-12-22","broken","2025-12-22","User Management","user-management.spec.ts","",""
"","1242","should display appropriate empty state","chromium","2025-12-22","passed","2025-12-22","UI/UX Tests","ui-ux.spec.ts","",""
"","10087","should persist authentication across page navigation","chromium","2025-12-22","failed","2025-12-22","Authentication Tests","authentication.spec.ts","",""
"","314","should show validation feedback on blur","chromium","2025-12-22","passed","2025-12-22","Form Validation Tests","form-validation.spec.ts","",""
"","11250","should show loading indicators during operations","chromium","2025-12-22","failed","2025-12-22","UI/UX Tests","ui-ux.spec.ts","",""
"","30024","should have sufficient button sizes for touch targets","chromium","2025-12-22","broken","2025-12-22","Accessibility Tests","accessibility.spec.ts","",""
"","1204","should send correct POST request for user creation","chromium","2025-12-22","passed","2025-12-22","API Integration Tests","api-integration.spec.ts","",""
"","30021","should format dates consistently","chromium","2025-12-22","broken","2025-12-22","UI/UX Tests","ui-ux.spec.ts","",""
"","10084","should show authorized state after successful authentication","chromium","2025-12-22","failed","2025-12-22","Authentication Tests","authentication.spec.ts","",""
"","221","should have accessible color contrast","chromium","2025-12-22","failed","2025-12-22","UI/UX Tests","ui-ux.spec.ts","",""
"","209","should display error for empty form","chromium","2025-12-22","passed","2025-12-22","User Management","user-management.spec.ts","",""
"","179","should have accessible button states","chromium","2025-12-22","passed","2025-12-22","Accessibility Tests","accessibility.spec.ts","",""
"","30021","should scroll to top when editing user","chromium","2025-12-22","broken","2025-12-22","UI/UX Tests","ui-ux.spec.ts","",""
"","5736","should have responsive design","chromium","2025-12-22","failed","2025-12-22","UI/UX Tests","ui-ux.spec.ts","",""
"","30021","should have ARIA labels on interactive elements","chromium","2025-12-22","broken","2025-12-22","Accessibility Tests","accessibility.spec.ts","",""
"","30023","should have proper color contrast ratios","chromium","2025-12-22","broken","2025-12-22","Accessibility Tests","accessibility.spec.ts","",""
"","30025","should delete a user","chromium","2025-12-22","broken","2025-12-22","User Management","user-management.spec.ts","",""
"","247","should require name field","chromium","2025-12-22","passed","2025-12-22","Form Validation Tests","form-validation.spec.ts","",""
"","170","should display loading state during API calls","chromium","2025-12-22","passed","2025-12-22","API Integration Tests","api-integration.spec.ts","",""
"","3016","should handle rapid form submissions","chromium","2025-12-22","failed","2025-12-22","Performance Tests","performance.spec.ts","",""
"","262","should have keyboard navigation support","chromium","2025-12-22","passed","2025-12-22","UI/UX Tests","ui-ux.spec.ts","",""
"","30021","should cancel edit mode","chromium","2025-12-22","broken","2025-12-22","User Management","user-management.spec.ts","",""
"","328","should have proper heading hierarchy","chromium","2025-12-22","passed","2025-12-22","Accessibility Tests","accessibility.spec.ts","",""
"","5184","should display table headers correctly","chromium","2025-12-22","failed","2025-12-22","UI/UX Tests","ui-ux.spec.ts","",""
"","10087","should show error message for invalid credentials","chromium","2025-12-22","failed","2025-12-22","Authentication Tests","authentication.spec.ts","",""
"","2282","should handle API errors gracefully","chromium","2025-12-22","passed","2025-12-22","API Integration Tests","api-integration.spec.ts","",""
"","241","should prevent special characters in name","chromium","2025-12-22","passed","2025-12-22","Form Validation Tests","form-validation.spec.ts","",""
"","30020","should show hover effects on interactive elements","chromium","2025-12-22","broken","2025-12-22","UI/UX Tests","ui-ux.spec.ts","",""
"","10266","should trim whitespace from inputs","chromium","2025-12-22","failed","2025-12-22","Form Validation Tests","form-validation.spec.ts","",""
"","30020","should maintain performance with concurrent operations","chromium","2025-12-22","broken","2025-12-22","Performance Tests","performance.spec.ts","",""
"","30022","should have consistent button styles","chromium","2025-12-22","broken","2025-12-22","UI/UX Tests","ui-ux.spec.ts","",""
"","5286","should efficiently update user list after operations","chromium","2025-12-22","failed","2025-12-22","Performance Tests","performance.spec.ts","",""
"","30024","should delete the 10 previously created users","chromium","2025-12-22","broken","2025-12-22","User Management","user-management.spec.ts","",""
"","10091","should display authentication scheme information","chromium","2025-12-22","failed","2025-12-22","Authentication Tests","authentication.spec.ts","",""
"","10084","should support API key authentication method","chromium","2025-12-22","failed","2025-12-22","Authentication Tests","authentication.spec.ts","",""
"","5171","should handle edit operations efficiently","chromium","2025-12-22","failed","2025-12-22","Performance Tests","performance.spec.ts","",""
"","5193","should load user list quickly","chromium","2025-12-22","failed","2025-12-22","Performance Tests","performance.spec.ts","",""
